
    =========================== USB Port10 ===========================

Connection Status        : 0x01 (Device is connected)
Port Chain               : 1-10

      ========================== Summary =========================
Vendor ID                : 0x552D (Unknown Vendor)
Product ID               : 0x4348
USB Version              : 1.10
Port maximum Speed       : High-Speed
Device maximum Speed     : Full-Speed
Device Connection Speed  : Full-Speed
Self powered             : no
Demanded Current         : 100 mA
Used Endpoints           : 1

      ======================== USB Device ========================

        +++++++++++++++++ Device Information ++++++++++++++++++
Device Description       : USB Composite Device
Device Path              : \\?\USB#VID_552D&PID_4348#5&1f03ab54&0&10#{a5dcbf10-6530-11d2-901f-00c04fb951ed} (GUID_DEVINTERFACE_USB_DEVICE)
Kernel Name              : \Device\USBPDO-12
Device ID                : USB\VID_552D&PID_4348\5&1F03AB54&0&10
Hardware IDs             : USB\VID_552D&PID_4348&REV_?110 USB\VID_552D&PID_4348
Driver KeyName           : {36fc9e60-c465-11cf-8056-444553540000}\0013 (GUID_DEVCLASS_USB)
Driver                   : \SystemRoot\System32\drivers\usbccgp.sys (Version: 10.0.19041.488  Date: 2021-10-06)
Driver Inf               : C:\Windows\inf\usb.inf
Legacy BusType           : PNPBus
Class                    : USB
Class GUID               : {36fc9e60-c465-11cf-8056-444553540000} (GUID_DEVCLASS_USB)
Service                  : usbccgp
Enumerator               : USB
Location Info            : Port_#0010.Hub_#0002
Location IDs             : PCIROOT(0)#PCI(1400)#USBROOT(0)#USB(10), ACPI(_SB_)#ACPI(PCI0)#ACPI(XHC_)#ACPI(RHUB)#ACPI(HS10)
Container ID             : {8779f924-feaf-11ec-88f0-001a7dda7111}
Manufacturer Info        : (Standard USB Host Controller)
Capabilities             : 0x84 (Removable, SurpriseRemovalOK)
Status                   : 0x0180600A (DN_DRIVER_LOADED, DN_STARTED, DN_DISABLEABLE, DN_REMOVABLE, DN_NT_ENUMERATOR, DN_NT_DRIVER)
Problem Code             : 0
Address                  : 10
HcDisableSelectiveSuspend: 0
EnableSelectiveSuspend   : 0
SelectiveSuspendEnabled  : 0
EnhancedPowerMgmtEnabled : 0
IdleInWorkingState       : 0
WakeFromSleepState       : 0
Power State              : D0 (supported: D0, D3, wake from D0)
 Child Device 1          : USB Midi (USB Audio Device)
  Device Path 1          : \\?\USB#VID_552D&PID_4348&MI_00#6&27f13e2d&0&0000#{6994ad04-93ef-11d0-a3cc-00a0c9223196}\global (AM_KSCATEGORY_AUDIO)
  Device Path 2          : \\?\USB#VID_552D&PID_4348&MI_00#6&27f13e2d&0&0000#{65e8773d-8f56-11d0-a3b9-00a0c9223196}\global (AM_KSCATEGORY_CAPTURE)
  Device Path 3          : \\?\USB#VID_552D&PID_4348&MI_00#6&27f13e2d&0&0000#{65e8773e-8f56-11d0-a3b9-00a0c9223196}\global (AM_KSCATEGORY_RENDER)
  Kernel Name            : \Device\00000116
  Device ID              : USB\VID_552D&PID_4348&MI_00\6&27F13E2D&0&0000
  Class                  : MEDIA
  Driver KeyName         : {4d36e96c-e325-11ce-bfc1-08002be10318}\0001 (GUID_DEVCLASS_MEDIA)
  Service                : usbaudio
  Location               : 0000.0014.0000.010.000.000.000.000.000
  LocationPaths          : PCIROOT(0)#PCI(1400)#USBROOT(0)#USB(10)#USBMI(0)  PCIROOT(0)#PCI(1400)#USBROOT(0)#USB(10)#USB(10)  ACPI(_SB_)#ACPI(PCI0)#ACPI(XHC_)#ACPI(RHUB)#ACPI(HS10)#USBMI(0)  ACPI(_SB_)#ACPI(PCI0)#ACPI(XHC_)#ACPI(RHUB)#ACPI(HS10)#USB(10)
   Child Device 1        : USB Midi [0] (Generic software device)
    Device ID            : SWD\MMDEVAPI\MIDII_E77EF9B1.P_0000
    Class                : SoftwareDevice
    Driver KeyName       : {62f9c741-b25a-46ce-b54c-9bccce08b6f2}\0009 (GUID_DEVCLASS_SWD)
   Child Device 2        : USB Midi [1] (Generic software device)
    Device ID            : SWD\MMDEVAPI\MIDII_E77EF9B1.P_0001
    Class                : SoftwareDevice
    Driver KeyName       : {62f9c741-b25a-46ce-b54c-9bccce08b6f2}\0010 (GUID_DEVCLASS_SWD)

        ---------------- Connection Information ---------------
Connection Index         : 0x0A (Port 10)
Connection Status        : 0x01 (DeviceConnected)
Current Config Value     : 0x00 (Configuration 0)   ERROR: must be non-zero
Device Address           : 0x11 (17)
Is Hub                   : 0x00 (no)
Device Bus Speed         : 0x01 (Full-Speed)
Number Of Open Pipes     : 0x00 (0 pipes to data endpoints)
Data (HexDump)           : 0A 00 00 00 12 01 10 01 00 00 00 08 2D 55 48 43   ............-UHC
                           10 F1 00 02 00 01 00 01 00 11 00 00 00 00 00 01   ................
                           00 00 00                                          ...

        --------------- Connection Information V2 -------------
Connection Index         : 0x0A (10)
Length                   : 0x10 (16 bytes)
SupportedUsbProtocols    : 0x03
 Usb110                  : 1 (yes, port supports USB 1.1)
 Usb200                  : 1 (yes, port supports USB 2.0)
 Usb300                  : 0 (no, port not supports USB 3.0)
 ReservedMBZ             : 0x00
Flags                    : 0x00
 DevIsOpAtSsOrHigher     : 0 (Device is not operating at SuperSpeed or higher)
 DevIsSsCapOrHigher      : 0 (Device is not SuperSpeed capable or higher)
 DevIsOpAtSsPlusOrHigher : 0 (Device is not operating at SuperSpeedPlus or higher)
 DevIsSsPlusCapOrHigher  : 0 (Device is not SuperSpeedPlus capable or higher)
 ReservedMBZ             : 0x00
Data (HexDump)           : 0A 00 00 00 10 00 00 00 03 00 00 00 00 00 00 00   ................

    ---------------------- Device Descriptor ----------------------
bLength                  : 0x12 (18 bytes)
bDescriptorType          : 0x01 (Device Descriptor)
bcdUSB                   : 0x110 (USB Version 1.10)
bDeviceClass             : 0x00 (defined by the interface descriptors)
bDeviceSubClass          : 0x00
bDeviceProtocol          : 0x00
bMaxPacketSize0          : 0x08 (8 bytes)
idVendor                 : 0x552D (Unknown Vendor)
idProduct                : 0x4348
bcdDevice                : 0xF110
iManufacturer            : 0x00 (No String Descriptor)
iProduct                 : 0x02 (String Descriptor 2)
 Language 0x0409         : "USB Midi        "
iSerialNumber            : 0x00 (No String Descriptor)
bNumConfigurations       : 0x01 (1 Configuration)
Data (HexDump)           : 12 01 10 01 00 00 00 08 2D 55 48 43 10 F1 00 02   ........-UHC....
                           00 01                                             ..

    ------------------ Configuration Descriptor -------------------
bLength                  : 0x09 (9 bytes)
bDescriptorType          : 0x02 (Configuration Descriptor)
wTotalLength             : 0x0065 (101 bytes)
bNumInterfaces           : 0x02 (2 Interfaces)
bConfigurationValue      : 0x01 (Configuration 1)
iConfiguration           : 0x00 (No String Descriptor)
bmAttributes             : 0x80
 D7: Reserved, set 1     : 0x01
 D6: Self Powered        : 0x00 (no)
 D5: Remote Wakeup       : 0x00 (no)
 D4..0: Reserved, set 0  : 0x00
MaxPower                 : 0x32 (100 mA)
Data (HexDump)           : 09 02 65 00 02 01 00 80 32 09 04 00 00 00 01 01   ..e.....2.......
                           00 00 09 24 01 00 01 09 00 01 01 09 04 01 00 02   ...$............
                           01 03 00 00 07 24 01 00 01 41 00 06 24 02 01 01   .....$...A..$...
                           00 06 24 02 02 02 00 09 24 03 01 03 01 02 01 00   ..$.....$.......
                           09 24 03 02 04 01 01 01 00 09 05 81 02 08 00 00   .$..............
                           00 00 05 25 01 01 03 09 05 02 02 08 00 00 00 00   ...%............
                           05 25 01 01 01                                    .%...

        ---------------- Interface Descriptor -----------------
bLength                  : 0x09 (9 bytes)
bDescriptorType          : 0x04 (Interface Descriptor)
bInterfaceNumber         : 0x00 (Interface 0)
bAlternateSetting        : 0x00
bNumEndpoints            : 0x00 (Default Control Pipe only)
bInterfaceClass          : 0x01 (Audio)
bInterfaceSubClass       : 0x01 (Audio Control)
bInterfaceProtocol       : 0x00
iInterface               : 0x00 (No String Descriptor)
Data (HexDump)           : 09 04 00 00 00 01 01 00 00                        .........

        ------ Audio Control Interface Header Descriptor ------
bLength                  : 0x09 (9 bytes)
bDescriptorType          : 0x24 (Audio Interface Descriptor)
bDescriptorSubtype       : 0x01 (Header)
bcdADC                   : 0x0100
wTotalLength             : 0x0009 (9 bytes)
bInCollection            : 0x01
baInterfaceNr[1]         : 0x01
Data (HexDump)           : 09 24 01 00 01 09 00 01 01                        .$.......

        ---------------- Interface Descriptor -----------------
bLength                  : 0x09 (9 bytes)
bDescriptorType          : 0x04 (Interface Descriptor)
bInterfaceNumber         : 0x01 (Interface 1)
bAlternateSetting        : 0x00
bNumEndpoints            : 0x02 (2 Endpoints)
bInterfaceClass          : 0x01 (Audio)
bInterfaceSubClass       : 0x03 (MIDI Streaming)
bInterfaceProtocol       : 0x00
iInterface               : 0x00 (No String Descriptor)
Data (HexDump)           : 09 04 01 00 02 01 03 00 00                        .........

        - MIDI Adapter Class specific MS Interface Descriptor -
bLength                  : 0x07 (7 bytes)
bDescriptorType          : 0x24 (Class Specific Interface Descriptor)
bDescriptorSubtype       : 0x01 (MS Header)
bcdADC                   : 0x0100
wTotalLength             : 0x0041 (65 bytes)
Data (HexDump)           : 07 24 01 00 01 41 00 06 24 02 01 01 00 06 24 02   .$...A..$.....$.
                           02 02 00 09 24 03 01 03 01 02 01 00 09 24 03 02   ....$........$..
                           04 01 01 01 00 09 05 81 02 08 00 00 00 00 05 25   ...............%
                           01 01 03 09 05 02 02 08 00 00 00 00 05 25 01 01   .............%..
                           01                                                .

        ---------------- MIDI IN Jack Descriptor --------------
bLength                  : 0x06 (6 bytes)
bDescriptorType          : 0x24 (Class Specific Interface Descriptor)
bDescriptorSubtype       : 0x02 (MIDI_IN_JACK)
bJackType                : 0x01 (Embedded)
bJackID                  : 0x01 (ID=1)
iJack                    : 0x00 (No String Descriptor)
Data (HexDump)           : 06 24 02 01 01 00                                 .$....

        ---------------- MIDI IN Jack Descriptor --------------
bLength                  : 0x06 (6 bytes)
bDescriptorType          : 0x24 (Class Specific Interface Descriptor)
bDescriptorSubtype       : 0x02 (MIDI_IN_JACK)
bJackType                : 0x02 (External)
bJackID                  : 0x02 (ID=2)
iJack                    : 0x00 (No String Descriptor)
Data (HexDump)           : 06 24 02 02 02 00                                 .$....

        --------------- MIDI OUT Jack Descriptor --------------
bLength                  : 0x09 (9 bytes)
bDescriptorType          : 0x24 (Class Specific Interface Descriptor)
bDescriptorSubtype       : 0x03 (MIDI_OUT_JACK)
bJackType                : 0x01 (Embedded)
bJackID                  : 0x03 (ID=3)
bNrInputPins             : 0x01 (1 pin)
baSourceID[1]            : 0x02 (input pin connected to entity ID=2)
baSourcePin[1]           : 0x01 (connected to input pin number 1
iJack                    : 0x00 (No String Descriptor)
Data (HexDump)           : 09 24 03 01 03 01 02 01 00                        .$.......

        --------------- MIDI OUT Jack Descriptor --------------
bLength                  : 0x09 (9 bytes)
bDescriptorType          : 0x24 (Class Specific Interface Descriptor)
bDescriptorSubtype       : 0x03 (MIDI_OUT_JACK)
bJackType                : 0x02 (External)
bJackID                  : 0x04 (ID=4)
bNrInputPins             : 0x01 (1 pin)
baSourceID[1]            : 0x01 (input pin connected to entity ID=1)
baSourcePin[1]           : 0x01 (connected to input pin number 1
iJack                    : 0x00 (No String Descriptor)
Data (HexDump)           : 09 24 03 02 04 01 01 01 00                        .$.......

        ----------------- Endpoint Descriptor -----------------
bLength                  : 0x09 (9 bytes)
bDescriptorType          : 0x05 (Endpoint Descriptor)
bEndpointAddress         : 0x81 (Direction=IN EndpointID=1)
bmAttributes             : 0x02 (TransferType=Bulk)
wMaxPacketSize           : 0x0008 (8 bytes)
bInterval                : 0x00 (0 ms)
bRefresh                 : 0x00
bSynchAddress            : 0x00
Data (HexDump)           : 09 05 81 02 08 00 00 00 00                        .........

        --- Class-Specific MS Bulk Data Endpoint Descriptor ---
bLength                  : 0x05 (5 bytes)
bDescriptorType          : 0x25 (Audio Endpoint Descriptor)
bDescriptorSubtype       : 0x01 (MS General)
bNumEmbMIDIJack          : 0x01 (1 embedded MIDI jack)
baAssocJackID(1)         : 0x03 (Jack(1) ID=3)
Data (HexDump)           : 05 25 01 01 03                                    .%...

        ----------------- Endpoint Descriptor -----------------
bLength                  : 0x09 (9 bytes)
bDescriptorType          : 0x05 (Endpoint Descriptor)
bEndpointAddress         : 0x02 (Direction=OUT EndpointID=2)
bmAttributes             : 0x02 (TransferType=Bulk)
wMaxPacketSize           : 0x0008 (8 bytes)
bInterval                : 0x00 (0 ms)
bRefresh                 : 0x00
bSynchAddress            : 0x00
Data (HexDump)           : 09 05 02 02 08 00 00 00 00                        .........

        --- Class-Specific MS Bulk Data Endpoint Descriptor ---
bLength                  : 0x05 (5 bytes)
bDescriptorType          : 0x25 (Audio Endpoint Descriptor)
bDescriptorSubtype       : 0x01 (MS General)
bNumEmbMIDIJack          : 0x01 (1 embedded MIDI jack)
baAssocJackID(1)         : 0x01 (Jack(1) ID=1)
Data (HexDump)           : 05 25 01 01 01                                    .%...

    --------- Device Qualifier Descriptor (for High-Speed) --------
bLength                  : 0x0A (10 bytes)
bDescriptorType          : 0x06 (Device_qualifier Descriptor)
bcdUSB                   : 0x200 (USB Version 2.00)
bDeviceClass             : 0x00 (defined by the interface descriptors)
bDeviceSubClass          : 0x00
bDeviceProtocol          : 0x00
bMaxPacketSize0          : 0x40 (64 Bytes)
bNumConfigurations       : 0x01 (1 other-speed configuration)
bReserved                : 0x00
Data (HexDump)           : 0A 06 00 02 00 00 00 40 01 00                     .......@..

      -------------------- String Descriptors -------------------
             ------ String Descriptor 0 ------
bLength                  : 0x04 (4 bytes)
bDescriptorType          : 0x03 (String Descriptor)
Language ID[0]           : 0x0409 (English - United States)
Data (HexDump)           : 04 03 09 04                                       ....
             ------ String Descriptor 2 ------
bLength                  : 0x22 (34 bytes)
bDescriptorType          : 0x03 (String Descriptor)
Language 0x0409          : "USB Midi        "  *!*CAUTION  trailing space characters
Data (HexDump)           : 22 03 55 00 53 00 42 00 20 00 4D 00 69 00 64 00   ".U.S.B. .M.i.d.
                           69 00 20 00 20 00 20 00 20 00 20 00 20 00 20 00   i. . . . . . . .
                           20 00                                              .
